"Authors","Author full names","Author(s) ID","Title","Year","Source title","Volume","Issue","Art. No.","Page start","Page end","Cited by","DOI","Link","Abstract","Document Type","Publication Stage","Open Access","Source","EID"
"Ma S.; Li M.; Ren Y.; Wang X.","Ma, Siyao (59469422400); Li, Mingzhu (58362968800); Ren, Yanyi (60362924900); Wang, Xuebing (60362925000)","59469422400; 58362968800; 60362924900; 60362925000","Data mining and toxicity profile analysis of immune checkpoint inhibitor-related skin toxicity events based on FAERS; [基于 FAERS 中免疫检查点抑制剂相关皮肤不良事件的数据挖掘与毒性特征分析]","2025","Journal of Central South University (Medical Sciences)","50","11","","1990","1991","0","10.11817/j.issn.1672-7347.2025.250316","https://www.scopus.com/pages/publications/105028953306?origin=resultslist","Objective: The widespread use of immune checkpoint inhibitors (ICIs) has led to breakthrough advances for patients with various advanced solid tumors. As the skin is an important target organ of immune responses, it is the most commonly affected site of treatment-related adverse events associated with ICIs, with a relatively high incidence of ICI-related skin toxicity events. Immune-related adverse events induced by ICIs are increasingly becoming a bottleneck limiting their clinical application. To collect post-marketing adverse events and medication errors related to drugs and therapeutic biological products and to evaluate real-world drug safety, the United States Food and Drug Administration (FDA) established the FDA Adverse Event Reporting System (FAERS) database. Based on the FAERS database, this study aims to systematically evaluate differences in the risk of skin toxicity events among different drug subtypes, cytotoxic-T-lymphocyte-associated antigen-4 inhibitors, programmed death-1 (PD-1) inhibitors, and programmed death-ligand 1 (PD-L1) inhibitors, and to explore the limitations and potential improvements of existing pharmacovigilance methods. Methods: Skin toxicity event data from the FAERS database between 2004 and 2024 were cleaned, standardized, and screened to identify adverse events associated with the target drugs. Pharmacovigilance signal detection methods, including the reporting odds ratio (ROR) method and Bayesian confidence propagation neural network (BCPNN) method, were used for the signals of ICIs-related skin toxicity event in the data, with stratified analyses by age and sex. For the ROR method, a skin toxicity event reporting count ≥3 and a lower bound of the 95% confidence interval (CI) >1 were used as criteria for a positive signal; for the Bayesian method, the information component was used as the core parameter. Subsequently, a systematic statistical analysis of the frequencies of different types of adverse events induced by different drugs was conducted, and outcomes associated with different drugs were summarized. Pharmacovigilance signal detection methods were applied for data analysis. Results: A total of 15 768 reports of skin-related adverse events were collected. The reported population was predominantly male, with most patients aged ≥65 years, and a higher proportion of cases from Europe and the United States. Among the reported indications, the 3 most common were malignant melanoma, non-small cell lung cancer, and metastatic melanoma. Most adverse events occurred within 30 days after drug administration, during which the number of reports was the highest. Using the two signal detection methods, positive signals were identified for 5 of the 8 target drugs: nivolumab (ROR=1.20, 95% CI 1.17 to 1.23), pembrolizumab (ROR=1.31, 95% CI 1.27 to 1.35), ipilimumab (ROR=1.82, 95% CI 1.74 to 1.90), atezolizumab (ROR=1.06, 95% CI 1.01 to 1.12), and tislelizumab (ROR=3.05, 95% CI 2.71 to 3.43). Further analysis showed that the PD-1 inhibitors pembrolizumab and nivolumab had higher numbers of reported cases of immune-mediated dermatitis, vitiligo, psoriasis, and other skin toxicity events than other ICIs. Comparison of outcomes of skin toxicity reactions caused by different drugs revealed that nivolumab-related cases had the highest numbers of reports of hospitalization, death, and life-threatening, followed by pembrolizumab. Conclusion: Five ICIs may induce skin toxicity events, which exhibit specific population characteristics, temporal patterns, and toxicity profiles. When using the PD-1 inhibitors nivolumab or pembrolizumab, particular vigilance is required for severe cutaneous toxicity to avoid unfavorable outcomes. Expanding the sample size and incorporating machine learning in the future may improve the precision and clinical translatability of signal detection, providing important evidence for optimizing clinical monitoring strategies for ICIs and establishing toxicity early-warning models. ©Journal of Central South University (Medical Science). All rights reserved.","Article","Final","","Scopus","2-s2.0-105028953306"
"Courtenay L.A.; Barbero-García I.; Martínez-Lastras S.; Del Pozo S.; Corral M.; González-Aguilera D.","Courtenay, Lloyd A. (57200549280); Barbero-García, Innes (57194070901); Martínez-Lastras, Saray (58101759200); Del Pozo, Susana (55584563700); Corral, Miriam (59272291500); González-Aguilera, Diego (24477009700)","57200549280; 57194070901; 58101759200; 55584563700; 59272291500; 24477009700","Using computational learning for non-melanoma skin cancer and actinic keratosis near-infrared hyperspectral signature classification","2024","Photodiagnosis and Photodynamic Therapy","49","","104269","","","10","10.1016/j.pdpdt.2024.104269","https://www.scopus.com/pages/publications/85201451273?origin=resultslist","Background: The early detection of Non-Melanoma Skin Cancer (NMSC) is essential to ensure patients receive the most effective treatment. Diagnostic screening tools for NMSC are crucial due to high confusion rates with other types of skin lesions, such as Actinic Keratosis. Nevertheless, current means of diagnosing and screening patients rely on either visual criteria, that are often conditioned by subjectivity and experience, or highly invasive, slow, and costly methods, such as histological diagnoses. From this, the objectives of the present study are to test if classification accuracies improve in the Near-Infrared region of the electromagnetic spectrum, as opposed to previous research in shorter wavelengths. Methods: This study utilizes near-infrared hyperspectral imaging, within the range of 900.6 and 1454.8 nm. Images were captured for a total of 125 patients, including 66 patients with Basal Cell Carcinoma, 42 with cutaneous Squamous Cell Carcinoma, and 17 with Actinic Keratosis, to differentiate between healthy and unhealthy skin lesions. A combination of hybrid convolutional neural networks (for feature extraction) and support vector machine algorithms (as a final activation layer) was employed for analysis. In addition, we test whether transfer learning is feasible from networks trained on shorter wavelengths of the electromagnetic spectrum. Results: The implemented method achieved a general accuracy of over 80 %, with some tasks reaching over 90 %. F1 scores were also found to generally be over the optimal threshold of 0.8. The best results were obtained when detecting Actinic Keratosis, however differentiation between the two types of malignant lesions was often noted to be more difficult. These results demonstrate the potential of near-infrared hyperspectral imaging combined with advanced machine learning techniques in distinguishing NMSC from other skin lesions. Transfer learning was unsuccessful in improving the training of these algorithms. Conclusions: We have shown that the Near-Infrared region of the electromagnetic spectrum is highly useful for the identification and study of non-melanoma type skin lesions. While the results are promising, further research is required to develop more robust algorithms that can minimize the impact of noise in these datasets before clinical application is feasible. © 2024 The Author(s)","Article","Final","All Open Access; Gold Open Access; Green Open Access","Scopus","2-s2.0-85201451273"
"Lamb C.R.; Rieger-Christ K.M.; Reddy C.; Huang J.; Ding J.; Johnson M.; Walsh P.S.; Bulman W.A.; Lofaro L.R.; Wahidi M.M.; Feller-Kopman D.J.; Spira A.; Kennedy G.C.; Mazzone P.J.","Lamb, Carla R. (7102304156); Rieger-Christ, Kimberly M. (6602699362); Reddy, Chakravarthy (19638957600); Huang, Jing (57141051600); Ding, Jie (57205716521); Johnson, Marla (57221110375); Walsh, P. Sean (7401934115); Bulman, William A. (6507459426); Lofaro, Lori R. (57197764122); Wahidi, Momen M. (6603182033); Feller-Kopman, David J. (6603142726); Spira, Avrum (56831999300); Kennedy, Giulia C. (7201789175); Mazzone, Peter J. (7006263594)","7102304156; 6602699362; 19638957600; 57141051600; 57205716521; 57221110375; 7401934115; 6507459426; 57197764122; 6603182033; 6603142726; 56831999300; 7201789175; 7006263594","A Nasal Swab Classifier to Evaluate the Probability of Lung Cancer in Patients With Pulmonary Nodules","2024","Chest","165","4","","1009","1019","10","10.1016/j.chest.2023.11.036","https://www.scopus.com/pages/publications/85186727801?origin=resultslist","Background: Accurate assessment of the probability of lung cancer (pCA) is critical in patients with pulmonary nodules (PNs) to help guide decision-making. We sought to validate a clinical-genomic classifier developed using whole-transcriptome sequencing of nasal epithelial cells from patients with a PN ≤ 30 mm who smoke or have previously smoked. Research Question: Can the pCA in individuals with a PN and a history of smoking be predicted by a classifier that uses clinical factors and genomic data from nasal epithelial cells obtained by cytologic brushing? Study Design and Methods: Machine learning was used to train a classifier using genomic and clinical features on 1,120 patients with PNs labeled as benign or malignant established by a final diagnosis or a minimum of 12 months of radiographic surveillance. The classifier was designed to yield low-, intermediate-, and high-risk categories. The classifier was validated in an independent set of 312 patients, including 63 patients with a prior history of cancer (other than lung cancer), comparing the classifier prediction with the known clinical outcome. Results: In the primary validation set, sensitivity and specificity for low-risk classification were 96% and 42%, whereas sensitivity and specificity for high-risk classification was 58% and 90%, respectively. Sensitivity was similar across stages of non-small cell lung cancer, independent of subtype. Performance compared favorably with clinical-only risk models. Analysis of 63 patients with prior cancer showed similar performance as did subanalyses of patients with light vs heavy smoking burden and those eligible for lung cancer screening vs those who were not. Interpretation: The nasal classifier provides an accurate assessment of pCA in individuals with a PN ≤ 30 mm who smoke or have previously smoked. Classifier-guided decision-making could lead to fewer diagnostic procedures in patients without cancer and more timely treatment in patients with lung cancer. © 2024","Conference paper","Final","","Scopus","2-s2.0-85186727801"
"Crawford M.E.; Kamali K.; Dorey R.A.; MacIntyre O.C.; Cleminson K.; MacGillivary M.L.; Green P.J.; Langley R.G.; Purdy K.S.; DeCoste R.C.; Gruchy J.R.; Pasternak S.; Oakley A.; Hull P.R.","Crawford, Madeleine E. (58790158100); Kamali, Kiyana (57211956351); Dorey, Rachel A. (57224134360); MacIntyre, Olivia C. (58790442100); Cleminson, Kristyna (57219561858); MacGillivary, Michael L. (57843534200); Green, Peter J. (7402935643); Langley, Richard G. (7201699598); Purdy, Kerri S. (7007166420); DeCoste, Ryan C. (56597787900); Gruchy, Jennette R. (54930470400); Pasternak, Sylvia (6603846262); Oakley, Amanda (7005972528); Hull, Peter R. (17734595300)","58790158100; 57211956351; 57224134360; 58790442100; 57219561858; 57843534200; 7402935643; 7201699598; 7007166420; 56597787900; 54930470400; 6603846262; 7005972528; 17734595300","Using Artificial Intelligence as a Melanoma Screening Tool in Self-Referred Patients","2024","Journal of Cutaneous Medicine and Surgery","28","1","","37","43","12","10.1177/12034754231216967","https://www.scopus.com/pages/publications/85181194227?origin=resultslist","Introduction: Early detection of melanoma requires timely access to medical care. In this study, we examined the feasibility of using artificial intelligence (AI) to flag possible melanomas in self-referred patients concerned that a skin lesion might be cancerous. Methods: Patients were recruited for the study through advertisements in 2 hospitals in Halifax, Nova Scotia, Canada. Lesions of concern were initially examined by a trained medical student and if the study criteria were met, the lesions were then scanned using the FotoFinder System®. The images were analyzed using their proprietary computer software. Macroscopic and dermoscopic images were evaluated by 3 experienced dermatologists and a senior dermatology resident, all blinded to the AI results. Suspicious lesions identified by the AI or any of the 3 dermatologists were then excised. Results: Seventeen confirmed malignancies were found, including 10 melanomas. Six melanomas were not flagged by the AI. These lesions showed ambiguous atypical melanocytic proliferations, and all were diagnostically challenging to the dermatologists and to the dermatopathologists. Eight malignancies were seen in patients with a family history of melanoma. The AI’s ability to diagnose malignancy is not inferior to the dermatologists examining dermoscopic images. Conclusion: AI, used in this study, may serve as a practical skin cancer screening aid. While it does have technical and diagnostic limitations, its inclusion in a melanoma screening program, directed at those with a concern about a particular lesion would be valuable in providing timely access to the diagnosis of skin cancer. © The Author(s) 2023.","Article","Final","All Open Access; Green Open Access; Hybrid Gold Open Access","Scopus","2-s2.0-85181194227"
"Yang C.; Cai H.; Liu W.; Wang J.; You X.; Jin Y.; Tang M.; Liu D.; Wu Z.; Gao P.; Wang Q.","Yang, Chunhui (55675165000); Cai, Hong (56179040800); Liu, Wenwen (57201487588); Wang, Jian (60612591800); You, Xin (57189263369); Jin, Yinuo (59008130800); Tang, Mengyi (57880400700); Liu, Dan (60612626600); Wu, Zeming (59814675400); Gao, Peng (56438627400); Wang, Qi (57201920642)","55675165000; 56179040800; 57201487588; 60612591800; 57189263369; 59008130800; 57880400700; 60612626600; 59814675400; 56438627400; 57201920642","Cerebrospinal fluid metabolomics and machine learning identify novel biomarkers for lung cancer leptomeningeal metastasis","2026","Neuro-Oncology","28","4","","980","993","2","10.1093/neuonc/noaf270","https://www.scopus.com/pages/publications/105037656676?origin=resultslist","Background: Lung cancer leptomeningeal metastasis (LC-LM) severely impacts patient survival and quality of life, yet current diagnostic methods lack sufficient sensitivity and specificity, particularly for early detection. Cerebrospinal fluid (CSF) metabolomics may reveal specific biomarkers reflecting brain metastasis. Methods: We performed untargeted metabolomic profiling of CSF samples by high-resolution mass spectrometry in a cohort of 218 participants, including 99 samples from LC-LM (with cancer cells detected in the CSF), 12 samples from the lung cancer parenchymal brain metastases (with no cancer cells detected in the CSF), 27 samples from the control group, 21 samples from the breast cancer LM, 15 samples from patients with LM from other tumors such as melanoma and gastric cancer, and 36 samples from other diseases. Significant metabolites were identified and validated. Subsequently, targeted metabolomics was conducted on serum samples from an independent cohort (n = 233), including 50 LC-LM patients, 150 patients with primary lung cancer (stages I-III), and 33 benign pulmonary nodules. Results: Untargeted CSF metabolomics revealed a distinct metabolic signature in LC-LM patients. Differential analysis identified metabolites significantly altered in LC-LM, notably elevated lactic acid, N1, N12-diacetylspermine, and altered amino acid metabolites (eg, l-proline, l-glutamic acid), each demonstrating strong diagnostic accuracy individually, with area under the receiver operating characteristic curve (AUC) > 0.90. Machine learning classification models based on CSF metabolite panels achieved perfect diagnostic performance (AUC = 1.00) in distinguishing LC-LM from controls and other groups. Targeted validation of 5 top metabolites in serum samples confirmed their diagnostic utility, with N1, N12-diacetylspermine achieving an AUC of 0.882, superior to traditional protein biomarkers. Conclusion: CSF-based metabolomic profiling combined with machine learning offers a highly accurate and minimally invasive diagnostic tool for LC-LM. Serum validation further supports its translational potential, emphasizing its significance in clinical practice for improving early detection and potentially enhancing patient management and outcomes. © The Author(s) 2025. Published by Oxford University Press on behalf of the Society for Neuro-Oncology. All rights reserved. For commercial re-use, please contact reprints@oup.com for reprints and translation rights for reprints. All other permissions can be obtained through our RightsLink service via the Permissions link on the article page on our site—for further information please contact journals.permissions@oup.com.","Article","Final","All Open Access; Green Open Access","Scopus","2-s2.0-105037656676"
"CHADWICK W.F.; GANESH S.; DADZIE A.K.; EBRAHIMI B.; RAHIMI M.; SON T.; ALAHMADI R.; YAO X.; HEIFERMAN M.J.","CHADWICK, William F. (60164188000); GANESH, Sanjay (58764805900); DADZIE, Albert K. (57866914700); EBRAHIMI, Behrouz (58020421200); RAHIMI, Mojtaba (58046643900); SON, Taeyoon (23391329700); ALAHMADI, Reem (59236239500); YAO, Xincheng (13106204100); HEIFERMAN, Michael J. (35788837000)","60164188000; 58764805900; 57866914700; 58020421200; 58046643900; 23391329700; 59236239500; 13106204100; 35788837000","Clinical Applications of Artificial Intelligence in Uveal Melanoma","2025","Anticancer Research","45","11","","4669","4681","3","10.21873/anticanres.17817","https://www.scopus.com/pages/publications/105020364175?origin=resultslist","Despite major advances in ocular oncology, early diagnosis and risk stratification of uveal melanoma (UM) remain complicated, particularly in cases involving small or indeterminate lesions. These challenges are exacerbated by limited access to subspecialist care and the constraints of existing diagnostic frameworks. Artificial intelligence (AI) has emerged as a powerful tool in oncology and ophthalmology, capable of analyzing complex imaging, cytologic, and genomic data to support clinical decision-making. In UM, AI models have shown promise in improving lesion classification, predicting metastatic potential, and augmenting post-treatment surveillance. This review examines the current landscape of AI applications in UM, including tools for triage, prognostication, and post-treatment surveillance. We also focus on steps that must be taken to achieve end-stage clinical rollout, addressing critical barriers to implementation, such as model generalizability, explainability, workflow integration, and ethical considerations. Moving forward, the convergence of multimodal data, privacy-preserving model development, and patient-centered innovations may help translate these technologies into real-world practice. By addressing current limitations and aligning AI development with clinical needs, these tools could ultimately support earlier detection, more personalized care, and greater equity in access to specialist-driven management for UM. This is an open access article under the terms of the Creative Commons Attribution License, which permits use, distribution and reproduction in any medium, provided the original work is properly cited. ©2025 The Author(s). Anticancer Research is published by the International Institute of Anticancer Research","Review","Final","All Open Access; Green Open Access; Hybrid Gold Open Access","Scopus","2-s2.0-105020364175"
"Sugiyama S.; Yumimoto K.; Nakayama K.I.","Sugiyama, Shigeaki (57208801439); Yumimoto, Kanae (55239964500); Nakayama, Keiichi I. (7403667496)","57208801439; 55239964500; 7403667496","Immune Cell Profiling Reveals a Common Pattern in Premetastatic Niche Formation Across Various Cancer Types","2025","Cancer Medicine","14","1","e70557","","","0","10.1002/cam4.70557","https://www.scopus.com/pages/publications/85213713440?origin=resultslist","Background: Metastasis is the major cause of cancer-related mortality. The premetastatic niche is a promising target for its prevention. However, the generality and cellular dynamics in premetastatic niche formation have remained unclear. Aims: This study aimed to elucidate the generality and cellular dynamics in premetastatic niche formation. Materials and Methods: We performed comprehensive flow cytometric analysis of lung and peripheral immune cells at three time points (early premetastatic, late premetastatic, and micrometastatic phases) for mice with subcutaneous implants of three types of cancer cells (breast cancer, lung cancer, or melanoma cells). The immuno-cell profiles were then used to predict the metastatic phase by machine learning. Results: We found a common pattern of changes in both lung and peripheral immune cell profiles across the three cancer types, including a decrease in the proportion of eosinophils in the early premetastatic phase, an increase in that of regulatory T cells in the late premetastatic phase, and an increase in that of polymorphonuclear myeloid-derived suppressor cells and a decrease in that of B cells in the micrometastatic phase. Machine learning using immune cell profiles could predict the metastatic phase with approximately 75% accuracy. Discussion: Validation of our findings in humans will require data on the presence or absence of micrometastases in patients and the accumulation of comprehensive and temporal information on immune cells. In addition, blood proteins, extracellular vesicles, DNA, RNA, or metabolites may be useful for more accurate prediction. Conclusion: The discovery of generalities in premetastatic niche formation allow prediction of metastatic phase and provide a basis for the development of methods for early detection and prevention of cancer metastasis in a cancer type-independent manner. © 2024 The Author(s). Cancer Medicine published by John Wiley & Sons Ltd.","Article","Final","All Open Access; Gold Open Access; Green Open Access","Scopus","2-s2.0-85213713440"
