"Authors","Author full names","Author(s) ID","Title","Year","Source title","Volume","Issue","Art. No.","Page start","Page end","Cited by","DOI","Link","Abstract","Document Type","Publication Stage","Open Access","Source","EID"
"Gillstedt M.; Stempfle L.; Paoli J.; Johansson F.D.; Polesie S.","Gillstedt, Martin (39961170700); Stempfle, Lena (57252579700); Paoli, John (14631010100); Johansson, Fredrik D. (57205955235); Polesie, Sam (40262246200)","39961170700; 57252579700; 14631010100; 57205955235; 40262246200","Predicting Melanoma Impact on the Swedish Healthcare System from the Adult Population Using Machine Learning on Registry Data","2026","Acta Dermato-Venereologica","106","","adv44610","","","0","10.2340/actadv.v106.44610","https://www.scopus.com/pages/publications/105035265847?origin=resultslist","Melanoma incidence has increased in Western countries over the past 50 years, leading to significant healthcare costs. In Sweden, comprehensive healthcare registries enable large-scale prediction studies using machine learning. Several machine learning models were evaluated to predict melanoma diagnoses using Swedish registry data, assessing the added value of diagnostic and medication data beyond demographics. The study included all adults in Sweden with continuous residency for 9.5 years (n = 6,036,186). The outcome was a melanoma diagnosis, including melanoma in situ, recorded within 5 years after the index date (31 December 2014). Predictors included age, sex, income, education, marital status, region of birth, diagnoses, and dispensed drugs. Models tested were logistic regression, gradient boosting, random forests, and a neural network. A total of 38,582 individuals (0.64%) developed melanoma. The gradient boosting model using all predictors performed best, with an area under the receiving operating characteristics curve (AUC) of 0.735 (95% confidence interval [CI], 0.725–0.746). When diagnosis and medication data were excluded, AUC dropped to 0.681 (95% CI: 0.670–0.691). The findings highlight that including healthcare codes improves predictive performance, and demonstrate the utility of Swedish registries for computational phenotyping. This approach may support early detection of melanoma and targeted follow-up. © Author(s).","Article","Final","All Open Access; Gold Open Access; Green Open Access","Scopus","2-s2.0-105035265847"
"Goebel C.; Louden C.L.; McKenna R., Jr.; Onugha O.; Wachtel A.; Long T.","Goebel, Cherylle (57209821294); Louden, Christopher L. (36504236500); McKenna, Robert (7102156772); Onugha, Osita (57190880135); Wachtel, Andrew (56906122100); Long, Thomas (57209822961)","57209821294; 36504236500; 7102156772; 57190880135; 56906122100; 57209822961","Blood test shows high accuracy in detecting stage i non-small cell lung cancer","2020","BMC Cancer","20","1","137","","","9","10.1186/s12885-020-6625-x","https://www.scopus.com/pages/publications/85079825190?origin=resultslist","Background: In a previous study (Goebel et. al, Cancer Genomics Proteomics 16:229-244, 2019), we identified 33 biomarkers for an early stage (I-II) Non-Small Cell Lung Cancer (NSCLC) test with 90% accuracy, 80.3% sensitivity, and 95.4% specificity. For the current study, we used a narrowed ensemble of 21 biomarkers while retaining similar accuracy in detecting early stage lung cancer. Methods: A multiplex platform, 486 human plasma samples, and 21 biomarkers were used to develop and validate our algorithm which detects early stage NSCLC. The training set consisted of 258 human plasma with 79 Stage I-II NSCLC samples. The 21 biomarkers with the statistical model (Lung Cancer Detector Test 1, LCDT1) was then validated using 228 novel samples which included 55 Stage I NSCLC. Results: The LCDT1 exhibited 95.6% accuracy, 89.1% sensitivity, and 97.7% specificity in detecting Stage I NSCLC on the blind set. When only NSCLC cancers were analyzed, the specificity increased to 99.1%. Conclusions: Compared to current approved clinical methods for diagnosing NSCLC, the LCDT1 greatly improves accuracy while being non-invasive; a simple, cost-effective, early diagnostic blood test should result in expanding access and increase survival rate. © 2020 The Author(s).","Article","Final","All Open Access; Gold Open Access; Green Open Access","Scopus","2-s2.0-85079825190"
"Islam S.; Wishart G.C.; Walls J.; Hall P.; Seco de Herrera A.G.; Gan J.Q.; Raza H.","Islam, Shafiqul (59316744900); Wishart, Gordon C. (7006733429); Walls, Joseph (57197488140); Hall, Per (8161259600); Seco de Herrera, Alba G. (57348565300); Gan, John Q. (58282887100); Raza, Haider (57195623793)","59316744900; 7006733429; 57197488140; 8161259600; 57348565300; 58282887100; 57195623793","Leveraging AI and patient metadata to develop a novel risk score for skin cancer detection","2024","Scientific Reports","14","1","20842","","","8","10.1038/s41598-024-71244-2","https://www.scopus.com/pages/publications/85203247985?origin=resultslist","Melanoma of the skin is the 17th most common cancer worldwide. Early detection of suspicious skin lesions (melanoma) can increase 5-year survival rates by 20%. The 7-point checklist (7PCL) has been extensively used to suggest urgent referrals for patients with a possible melanoma. However, the 7PCL method only considers seven meta-features to calculate a risk score and is only relevant for patients with suspected melanoma. There are limited studies on the extensive use of patient metadata for the detection of all skin cancer subtypes. This study investigates artificial intelligence (AI) models that utilise patient metadata consisting of 23 attributes for suspicious skin lesion detection. We have identified a new set of most important risk factors, namely “C4C risk factors”, which is not just for melanoma, but for all types of skin cancer. The performance of the C4C risk factors for suspicious skin lesion detection is compared to that of the 7PCL and the Williams risk factors that predict the lifetime risk of melanoma. Our proposed AI framework ensembles five machine learning models and identifies seven new skin cancer risk factors: lesion pink, lesion size, lesion colour, lesion inflamed, lesion shape, lesion age, and natural hair colour, which achieved a sensitivity of 80.46±2.50% and a specificity of 62.09±1.90% in detecting suspicious skin lesions when evaluated using the metadata of 53,601 skin lesions collected from different skin cancer diagnostic clinics across the UK, significantly outperforming the 7PCL-based method (sensitivity 68.09±2.10%, specificity 61.07±0.90%) and the Williams risk factors (sensitivity 66.32±1.90%, specificity 61.71±0.6%). Furthermore, through weighting the seven new risk factors we came up with a new risk score, namely “C4C risk score”, which alone achieved a sensitivity of 76.09±1.20% and a specificity of 61.71±0.50%, significantly outperforming the 7PCL-based risk score (sensitivity 73.91±1.10%, specificity 49.49±0.50%) and the Williams risk score (sensitivity 60.68±1.30%, specificity 60.87±0.80%). Finally, fusing the C4C risk factors with the 7PCL and Williams risk factors achieved the best performance, with a sensitivity of 85.24±2.20% and a specificity of 61.12±0.90%. We believe that fusing these newly found risk factors and new risk score with image data will further boost the AI model performance for suspicious skin lesion detection. Hence, the new set of skin cancer risk factors has the potential to be used to modify current skin cancer referral guidelines for all skin cancer subtypes, including melanoma. © The Author(s) 2024.","Article","Final","All Open Access; Gold Open Access; Green Open Access","Scopus","2-s2.0-85203247985"
"Ju M.; Zhang J.; Deng Z.; Wei M.; Ma L.; Chen T.; Zhao L.","Ju, Mingyi (57216489679); Zhang, Jiaojiao (59246921600); Deng, Zhuoyuan (59246860800); Wei, Minjie (7202184532); Ma, Lianghua (55578420900); Chen, Ting (57204060772); Zhao, Lin (57054359400)","57216489679; 59246921600; 59246860800; 7202184532; 55578420900; 57204060772; 57054359400","Prophylactic IL-23 blockade uncouples efficacy and toxicity in dual CTLA-4 and PD-1 immunotherapy","2024","Journal for ImmunoTherapy of Cancer","12","7","e009345","","","18","10.1136/jitc-2024-009345","https://www.scopus.com/pages/publications/85200424547?origin=resultslist","Background Immune-related adverse events (irAEs), characterized by targeted inflammation, occur in up to 60% of patients with melanoma treated with immune checkpoint inhibitors (ICIs). Evidence proved that the baseline peripheral blood profiles of patients at risk for severe irAEs development paralleled clinical autoimmunity. Interleukin (IL)-23 blockade with risankizumab is recommended for cases that are suffering from autoimmune disease, such as autoimmune colitis. However, currently, the role of IL-23 in irAEs onset and severity remains poorly understood. Methods The pro-inflammatory cytokines most associated with severe irAEs onset were identified by retrospective analysis based on GSE186143 data set. To investigate the efficacy of prophylactic IL-23 blockade administration to prevent irAEs, refer to a previous study, we constructed two irAEs murine models, including dextran sulfate sodium salt (DSS)-induced colitis murine model and a combined-ICIs-induced irAEs murine model. To further explore the applicability of our findings, murine models with graft-versus-host disease were established, in which Rag2 -/- Il2rg -/- mice were transferred with human peripheral blood mononuclear cells and received combined cytotoxic T-lymphocyte associated antigen 4 (CTLA-4) and programmed cell death protein-1 (PD-1) treatment. Human melanoma cells were xenografted into these mice concomitantly. Results Here we show that IL-23 was upregulated in the serum of patients suffering from irAEs after dual anti-CTLA-4 and anti-PD-1 treatment, and increased as a function of irAEs severity. Additionally, Augmented CD4 + Tems may preferentially underlie irAEs onset. Treating mice with anti-mouse IL-23 antibody concomitantly with combined CTLA-4 and PD-1 immunotherapy ameliorates colitis and, in addition, preserves antitumor efficacy. Moreover, in xenografted murine models with irAEs, prophylactic blockade of human IL-23 using clinically available IL-23 inhibitor (risankizumab) ameliorated colitis, hepatitis and lung inflammation, and moreover, immunotherapeutic control of tumors was retained. Finally, we also provided a novel machine learning-based computational framework based on two blood-based features - IL-23 and CD4 + Tems - that may have predictive potential for severe irAEs and ICIs response. Conclusions Our study not only provides clinically feasible strategies to dissociate efficacy and toxicity in the use of combined ICIs for cancer immunotherapy, but also develops a blood-based biomarker that makes it possible to achieve a straightforward and non-invasive, detection assay for early prediction of irAEs onset.  © Author(s) (or their employer(s)) 2024.","Article","Final","All Open Access; Gold Open Access; Green Open Access","Scopus","2-s2.0-85200424547"
"Premaladha J.; Ravichandran K.S.","Premaladha, J. (56181566900); Ravichandran, K.S. (7102687553)","56181566900; 7102687553","Novel Approaches for Diagnosing Melanoma Skin Lesions Through Supervised and Deep Learning Algorithms","2016","Journal of Medical Systems","40","4","96","1","12","189","10.1007/s10916-016-0460-2","https://www.scopus.com/pages/publications/84958051709?origin=resultslist","Dermoscopy is a technique used to capture the images of skin, and these images are useful to analyze the different types of skin diseases. Malignant melanoma is a kind of skin cancer whose severity even leads to death. Earlier detection of melanoma prevents death and the clinicians can treat the patients to increase the chances of survival. Only few machine learning algorithms are developed to detect the melanoma using its features. This paper proposes a Computer Aided Diagnosis (CAD) system which equips efficient algorithms to classify and predict the melanoma. Enhancement of the images are done using Contrast Limited Adaptive Histogram Equalization technique (CLAHE) and median filter. A new segmentation algorithm called Normalized Otsu’s Segmentation (NOS) is implemented to segment the affected skin lesion from the normal skin, which overcomes the problem of variable illumination. Fifteen features are derived and extracted from the segmented images are fed into the proposed classification techniques like Deep Learning based Neural Networks and Hybrid Adaboost-Support Vector Machine (SVM) algorithms. The proposed system is tested and validated with nearly 992 images (malignant & benign lesions) and it provides a high classification accuracy of 93 %. The proposed CAD system can assist the dermatologists to confirm the decision of the diagnosis and to avoid excisional biopsies. © 2016, Springer Science+Business Media New York.","Article","Final","","Scopus","2-s2.0-84958051709"
"Biasi L.D.; Citarella A.A.; Risi M.; Tortora G.","Biasi, Luigi DI (57188978927); Citarella, Alessia Auriemma (57226113587); Risi, Michele (9275600300); Tortora, Genoveffa (35587906400)","57188978927; 57226113587; 9275600300; 35587906400","A Cloud Approach for Melanoma Detection Based on Deep Learning Networks","2022","IEEE Journal of Biomedical and Health Informatics","26","3","","962","972","46","10.1109/JBHI.2021.3113609","https://www.scopus.com/pages/publications/85125964999?origin=resultslist","In the era of digitized images, the goal is to extract information from them and create new knowledge thanks to Computer Vision techniques, Machine Learning and Deep Learning. This enables the use of images for early diagnosis and subsequent treatment of a wide range of diseases. In the dermatological field, deep neural networks are used to distinguish between melanoma and non-melanoma images. In this paper, we have underlined two essential points of melanoma detection research. The first aspect considered is how even a simple modification of the parameters in the dataset determines a change of the accuracy of classifiers. In this case, we investigated the Transfer Learning issues. Following the results of this first analysis, we suggest that continuous training-test iterations are needed to provide robust prediction models. The second point is the need to have a more flexible system architecture that can handle changes in the training datasets. In this context, we proposed the development and implementation of a hybrid architecture based on Cloud, Fog and Edge Computing to provide a Melanoma Detection service based on clinical and dermoscopic images. At the same time, this architecture must deal with the amount of data to be analyzed by reducing the running time of the continuous retrain. This fact has been highlighted with experiments carried out on a single machine and different distribution systems, showing how a distributed approach guarantees output achievement in a much more sufficient time.  © 2013 IEEE.","Article","Final","","Scopus","2-s2.0-85125964999"
"Bollard S.M.; Howard J.; Casalou C.; Kelly B.S.; O'Donnell K.; Fenn G.; O'Reilly J.; Milling R.; Shields M.; Wilson M.; Ajaykumar A.; Triana K.; Wynne K.; Tobin D.J.; Kelly P.A.; McCann A.; Potter S.M.","Bollard, S.M. (57191953052); Howard, J. (57212977509); Casalou, C. (6507075922); Kelly, B.S. (57188853687); O'Donnell, K. (57470180300); Fenn, G. (59365343100); O'Reilly, J. (59293767600); Milling, R. (57900495800); Shields, M. (59365217400); Wilson, M. (59440200900); Ajaykumar, A. (59068056500); Triana, K. (59067050600); Wynne, K. (16070045400); Tobin, D.J. (57221458935); Kelly, P.A. (55984410900); McCann, A. (7003674061); Potter, S.M. (57206541918)","57191953052; 57212977509; 6507075922; 57188853687; 57470180300; 59365343100; 59293767600; 57900495800; 59365217400; 59440200900; 59068056500; 59067050600; 16070045400; 57221458935; 55984410900; 7003674061; 57206541918","Proteomic and metabolomic profiles of plasma-derived Extracellular Vesicles differentiate melanoma patients from healthy controls","2024","Translational Oncology","50","","102152","","","17","10.1016/j.tranon.2024.102152","https://www.scopus.com/pages/publications/85206242732?origin=resultslist","Background: Plasma-derived Extracellular Vesicles (EVs) have been suggested as novel biomarkers in melanoma, due to their ability to reflect the cell of origin and ease of collection. This study aimed to identify novel EV biomarkers that can discriminate between disease stages. This was achieved by characterising the plasma-derived EVs of patients with melanoma, and comparing their proteomic and metabolomic profile to those from healthy controls. Methods: EVs were isolated from the plasma of 36 patients with melanoma and 13 healthy controls using Size Exclusion Chromatography. Proteomic and Metabolomic Analyses were performed, and machine learning algorithms were used to identify potential proteins and metabolites to differentiate the plasma-derived EVs from melanoma patients of different disease stages. Results: The concentration and size of the EV population isolated was similar between groups. Proteins (APOC4, PRG4, PLG, TNC, VWF and SERPIND1) and metabolites (lyso PC a C18:2, PC ae C44:3) previously associated with melanoma pathogenesis were identified as relevant in differentiating between disease stages. Conclusion: The results further support the continued investigation of circulating plasma-derived EVs as biomarkers in melanoma. Furthermore, the potential of combined proteo-metabolomic signatures for differentiation between disease stages may provide valuable insights into early detection, prognosis, and personalised treatment strategies. © 2024","Article","Final","All Open Access; Gold Open Access; Green Open Access","Scopus","2-s2.0-85206242732"
"Ma J.; Iddir S.P.; Ganesh S.; Yi D.; Heiferman M.J.","Ma, Jiechao (57225207950); Iddir, Sabrina P. (58728241200); Ganesh, Sanjay (58764805900); Yi, Darvin (57206277441); Heiferman, Michael J. (35788837000)","57225207950; 58728241200; 58764805900; 57206277441; 35788837000","Automated segmentation for early detection of uveal melanoma","2024","Canadian Journal of Ophthalmology","59","6","","e784","e791","14","10.1016/j.jcjo.2024.04.003","https://www.scopus.com/pages/publications/85194355364?origin=resultslist","Objective: Uveal melanoma is the most common intraocular malignancy in adults. Current screening and triaging methods for melanocytic choroidal tumours face inherent limitations, particularly in regions with limited access to specialized ocular oncologists. This study explores the potential of machine learning to automate tumour segmentation. We develop and evaluate a machine-learning model for lesion segmentation using ultra-wide-field fundus photography. Method: A retrospective chart review was conducted of patients diagnosed with uveal melanoma, choroidal nevi, or congenital hypertrophy of the retinal pigmented epithelium at a tertiary academic medical centre. Included patients had a single ultra-wide-field fundus photograph (Optos PLC, Dunfermline, Fife, Scotland) of adequate quality to visualize the lesion of interest, as confirmed by a single ocular oncologist. These images were used to develop and test a machine-learning algorithm for lesion segmentation. Results: A total of 396 images were used to develop a machine-learning algorithm for lesion segmentation. Ninety additional images were used in the testing data set along with images of 30 healthy control individuals. Of the images with successfully detected lesions, the machine-learning segmentation yielded Dice coefficients of 0.86, 0.81, and 0.85 for uveal melanoma, choroidal nevi, and congenital hypertrophy of the retinal pigmented epithelium, respectively. Sensitivities for any lesion detection per image were 1.00, 0.90, and 0.87, respectively. For images without lesions, specificity was 0.93. Conclusion: Our study demonstrates a novel machine-learning algorithm's performance, suggesting its potential clinical utility as a widely accessible method of screening choroidal tumours. Additional evaluation methods are necessary to further enhance the model's lesion classification and diagnostic accuracy. © 2024","Article","Final","All Open Access; Bronze Open Access; Green Open Access","Scopus","2-s2.0-85194355364"
"Kiran A.; Narayanasamy N.; Ramesh J.V.N.; Ahmad M.W.","Kiran, Ajmeera (57203283005); Narayanasamy, Navaprakash (57203341274); Ramesh, Janjhyam Venkata Naga (59253432200); Ahmad, Mohd Wazih (36245794300)","57203283005; 57203341274; 59253432200; 36245794300","A novel deep learning framework for accurate melanoma diagnosis integrating imaging and genomic data for improved patient outcomes","2024","Skin Research and Technology","30","6","e13770","","","12","10.1111/srt.13770","https://www.scopus.com/pages/publications/85196072734?origin=resultslist","Background: Melanoma is one of the most malignant forms of skin cancer, with a high mortality rate in the advanced stages. Therefore, early and accurate detection of melanoma plays an important role in improving patients' prognosis. Biopsy is the traditional method for melanoma diagnosis, but this method lacks reliability. Therefore, it is important to apply new methods to diagnose melanoma effectively. Aim: This study presents a new approach to classify melanoma using deep neural networks (DNNs) with combined multiple modal imaging and genomic data, which could potentially provide more reliable diagnosis than current medical methods for melanoma. Method: We built a dataset of dermoscopic images, histopathological slides and genomic profiles. We developed a custom framework composed of two widely established types of neural networks for analysing image data Convolutional Neural Networks (CNNs) and networks that can learn graph structure for analysing genomic data-Graph Neural Networks. We trained and evaluated the proposed framework on this dataset. Results: The developed multi-modal DNN achieved higher accuracy than traditional medical approaches. The mean accuracy of the proposed model was 92.5% with an area under the receiver operating characteristic curve of 0.96, suggesting that the multi-modal DNN approach can detect critical morphologic and molecular features of melanoma beyond the limitations of traditional AI and traditional machine learning approaches. The combination of cutting-edge AI may allow access to a broader range of diagnostic data, which can allow dermatologists to make more accurate decisions and refine treatment strategies. However, the application of the framework will have to be validated at a larger scale and more clinical trials need to be conducted to establish whether this novel diagnostic approach will be more effective and feasible. © 2024 The Authors.","Retracted","Final","All Open Access; Green Open Access; Hybrid Gold Open Access","Scopus","2-s2.0-85196072734"
